{
  "$ref": "#/definitions/blog",
  "definitions": {
    "blog": {
      "type": "object",
      "properties": {
        "title": {
          "type": "string"
        },
        "description": {
          "type": "string"
        },
        "pubDate": {
          "anyOf": [
            {
              "type": "string",
              "format": "date-time"
            },
            {
              "type": "string",
              "format": "date"
            },
            {
              "type": "integer",
              "format": "unix-time"
            }
          ]
        },
        "updatedDate": {
          "anyOf": [
            {
              "type": "string",
              "format": "date-time"
            },
            {
              "type": "string",
              "format": "date"
            },
            {
              "type": "integer",
              "format": "unix-time"
            }
          ]
        },
        "category": {
          "type": "string"
        },
        "tags": {
          "type": "array",
          "items": {
            "type": "string"
          },
          "default": []
        },
        "featured": {
          "type": "boolean"
        },
        "heroImage": {
          "type": "string"
        },
        "readingTime": {
          "type": "number"
        },
        "slug": {
          "type": "string"
        },
        "hubRefs": {
          "type": "array",
          "items": {
            "type": "string"
          }
        },
        "primaryHub": {
          "type": "string"
        },
        "$schema": {
          "type": "string"
        }
      },
      "required": [
        "title",
        "pubDate"
      ],
      "additionalProperties": false
    }
  },
  "$schema": "http://json-schema.org/draft-07/schema#"
}