[{"slug":"2024_01_31_dipwset_thesis","title":"No and Low-Alcohol Wine: Demand, Production, and Future Growth","description":"An analysis of the demand and supply dynamics behind the growth of no and low-alcohol wine, alongside the technical tradeoffs in production, and the category’s future positioning","category":"wine","tags":["low alcohol wine","wine business","winemaking"],"pubDate":"2024-01-31T00:00:00.000Z","heroImage":"/_astro/image22.Dppr1hAn.webp"},{"slug":"2024_12_31_sherry_book_review","title":"Sherry: Book Notes","description":"Details about Sherry from the book by Julian Jeffs","category":"wine","tags":["fortified wine","Sherry","wine business"],"pubDate":"2024-12-31T00:00:00.000Z","heroImage":"/_astro/img1.C4G32c2p.webp"},{"slug":"2025_01_31_port_book_review","title":"Port and the Douro: Book Notes","description":"Details about Port from the book by Richard Mayson","category":"wine","tags":["fortified wine","Port","wine business"],"pubDate":"2025-01-31T00:00:00.000Z","heroImage":"/_astro/img1.DdLdNP-H.webp"},{"slug":"2025_10_31_cava_thesis","title":"Cava's Future: Growth Strategies for a Sparkling Wine at a Crossroads","description":"An analysis of Cava's market position, growth opportunities, and strategic marketing approaches to compete in an evolving sparkling wine market","category":"wine","tags":["sparkling wine","Cava","wine business"],"pubDate":"2025-10-31T00:00:00.000Z","heroImage":"/_astro/image13.Bt-8MBeN.webp"},{"slug":"2026_02_05_cava_educator_advanced","title":"Cava Educator Advanced - Day 1","description":"Highlights from the in person certification course organised by D.O. Cava","category":"wine","tags":["sparkling wine","Cava","winemaking"],"pubDate":"2026-02-05T00:00:00.000Z","heroImage":"/_astro/img2.CGFAP34J.webp"},{"slug":"2026_02_06_cava_educator_advanced_two","title":"Cava Educator Advanced - Day 2","description":"Highlights from the in person certification course organised by D.O. Cava","category":"wine","tags":["sparkling wine","Cava","winemaking"],"pubDate":"2026-02-06T00:00:00.000Z","heroImage":"/_astro/img3.Di7GKCmF.webp"},{"slug":"2026_04_17_how_to_read_cava_label","title":"How to Read a Cava Label: Guarda, Reserva, Gran Reserva, and Paraje Calificado","description":"A beginner-friendly guide to the most important Cava label terms, from Brut Nature and Guarda to Gran Reserva and Paraje Calificado","category":"wine","tags":["sparkling wine","Cava"],"pubDate":"2026-04-17T00:00:00.000Z","heroImage":"/_astro/img1.DR_gMcTL.webp"},{"slug":"2026_04_18_cava_vs_champagne_beginners","title":"Cava vs Champagne: What’s the Real Difference for Beginners?","description":"A beginner-friendly guide to the differences between Cava and Champagne, including grapes, style, price, and when to buy each","category":"wine","tags":["sparkling wine","Cava","Champagne"],"pubDate":"2026-04-18T00:00:00.000Z","heroImage":"/_astro/img1.CjJqHf0w.webp"},{"slug":"2026_04_24_port_styles_explained","title":"Port Styles Explained: Ruby, Tawny, LBV, Vintage, and Others","description":"A beginner-friendly guide to the main styles of Port","category":"wine","tags":["fortified wine","Port"],"pubDate":"2026-04-24T00:00:00.000Z","heroImage":"/_astro/img1.B9ClycAS.webp"},{"slug":"2026_04_27_chianti_classico_nyc","title":"Chianti Classico NYC 2026 tasting","description":"Notes from the industry tasting event in NY","category":"wine","tags":["wine business","winemaking"],"pubDate":"2026-04-27T00:00:00.000Z","heroImage":"/_astro/img1.DeOLvCp-.webp"}]